title,link,publisher,provider,datetime
"Analysts forecast Ethereum to reach $6,000 in 2024",https://cryptobriefing.com/ethereum-price-forecast-2024/,Crypto Briefing,NewsAPI,2024-08-14T12:04:58Z
Hilltop Holdings Inc. (HTH) To Go Ex-Dividend on August 16th,https://www.etfdailynews.com/2024/08/14/hilltop-holdings-inc-hth-to-go-ex-dividend-on-august-16th/,ETF Daily News,NewsAPI,2024-08-14T12:02:49Z
"S&U (LON:SUS) PT Lowered to GBX 2,100 at Berenberg Bank",https://www.etfdailynews.com/2024/08/14/su-lonsus-pt-lowered-to-gbx-2100-at-berenberg-bank/,ETF Daily News,NewsAPI,2024-08-14T12:02:46Z
Unlock massive savings at Pai International's lowest price sale: Don’t miss out on this limited time opportunity!,https://economictimes.indiatimes.com/industry/cons-products/electronics/unlock-massive-savings-at-pai-internationals-lowest-price-sale-dont-miss-out-on-this-limited-time-opportunity/articleshow/112525335.cms,The Times of India,NewsAPI,2024-08-14T12:01:32Z
"AIB share sale wouldn’t impact pay cap, McGrath told",https://www.irishtimes.com/business/2024/08/15/aib-share-sale-wouldnt-impact-pay-cap-mcgrath-told/,The Irish Times,GNews,2024-08-15T11:34:00Z
Money blog: Trendy area in uproar over Gail's potentially coming to high street,https://news.sky.com/story/money-blog-trendy-area-in-uproar-over-gails-potentially-coming-to-high-street-13040934,Sky News,GNews,2024-08-15T11:33:00Z
Center Parcs takes in €1.86m a week at Longford resort,https://www.irishtimes.com/business/2024/08/15/center-parcs-takes-in-186m-a-week-at-longford-resort/,The Irish Times,GNews,2024-08-15T11:00:00Z
Money blog: Aldi axing click and collect within days; Tesco reveals 'digital passport' plan; free stuff today if you show results,https://news.sky.com/story/money-blog-aldi-axing-click-and-collect-within-days-tesco-reveals-digital-passport-plan-free-stuff-today-if-you-show-results-13040934,Sky News,GNews,2024-08-15T10:08:00Z
Money blog: McDonald's to iPhones: The discounts you get as a student or young person,https://news.sky.com/story/money-blog-mcdonalds-to-iphones-the-discounts-you-get-as-a-student-or-young-person-13040934,Sky News,GNews,2024-08-15T08:50:00Z
"Martin Lewis explains after drivers wake up to £3,345 payment in bank account",https://www.birminghammail.co.uk/news/midlands-news/martin-lewis-explains-after-drivers-29742688,Birmingham Live,GNews,2024-08-15T08:32:44Z
Money blog: Aldi axes click and collect - as Tesco 'digital passport' plan revealed,https://news.sky.com/story/money-news-latest-consumer-blog-13040934,Sky News,GNews,2024-08-15T05:43:00Z
Will bitcoin become a strategic reserve asset for the U.S.?,https://finance.yahoo.com/news/bitcoin-become-strategic-asset-u-215504815.html,Yahoo Finance,GNews,2024-08-14T21:55:04Z
More 'universal' DWP payments scrapped and will cost people £300,https://www.birminghammail.co.uk/news/cost-of-living/more-universal-dwp-payments-scrapped-29741033,Birmingham Live,GNews,2024-08-14T17:28:14Z
