title,link,publisher,provider,datetime
Shiba Inu Investors Now Hold This New Cryptocurrency That Positioned To 1000x,https://bitcoinist.com/shiba-inu-investors-now-hold-this-new-cryptocurrency-that-positioned-to-1000x/,Bitcoinist,NewsAPI,2024-08-07T14:11:17Z
Cautious car buyers blamed for 10 per cent drop in car finance deals,https://www.autoexpress.co.uk/news/363990/cautious-car-buyers-blamed-10-cent-drop-car-finance-deals,AutoExpress,NewsAPI,2024-08-07T14:09:34Z
NMFTA’s Cybersecurity Team Continues to Showcase Expertise at Supply Chain Conferences This Fall,https://www.globenewswire.com/news-release/2024/08/07/2926088/0/en/NMFTA-s-Cybersecurity-Team-Continues-to-Showcase-Expertise-at-Supply-Chain-Conferences-This-Fall.html,GlobeNewswire,NewsAPI,2024-08-07T14:08:00Z
Ethereum (ETH) Whales Grab New 1000x Memecoin That Built On The Ethereum (ETH) Blockchain,https://bitcoinist.com/ethereum-eth-whales-grab-new-1000x-memecoin-that-built-on-the-ethereum-eth-blockchain/,Bitcoinist,NewsAPI,2024-08-07T14:06:54Z
"A 'soft landing' is still on the table, economists say",https://www.cnbc.com/2024/08/07/a-soft-landing-is-still-on-the-table-economists-say.html,CNBC,NewsAPI,2024-08-07T14:05:11Z
Greatest Roulette Web sites 2024: Where to Gamble On the internet Roulette for real Money,https://www.bloguismo.com/greatest-roulette-web-sites-2024-where-to-gamble-on-the-internet-roulette-for-real-money/,Bloguismo.com,NewsAPI,2024-08-07T14:04:14Z
"Start, maintain Public Provident Fund account, even in new tax regime",https://www.business-standard.com/finance/personal-finance/start-maintain-public-provident-fund-account-even-in-new-tax-regime-124080701457_1.html,Business Standard,NewsAPI,2024-08-07T14:03:19Z
"Planet to Announce Fiscal Second Quarter 2025 Results on Thursday, September 5, 2024",https://www.investing.com/news/press-releases/planet-to-announce-fiscal-second-quarter-2025-results-on-thursday-september-5-2024-93CH-3559827,Investing.com,NewsAPI,2024-08-07T14:01:00Z
LTCG amendment: Experts cheer decision to restore indexation benefit for property. Why this govt move matters,https://www.livemint.com/money/personal-finance/ltcg-amendment-experts-cheer-decision-to-restore-indexation-benefit-for-property-why-this-govt-move-matters-11723035869818.html,Livemint,NewsAPI,2024-08-07T14:00:35Z
I’m an Economist: Here’s What a Harris Win in November Would Mean for the Tax Burden on the Rich,https://finance.yahoo.com/news/m-economist-harris-win-november-140032296.html,Yahoo Entertainment,NewsAPI,2024-08-07T14:00:32Z
Mines ministry working on rolling out Critical Mineral Mission this year: Official,https://economictimes.indiatimes.com/industry/indl-goods/svs/metals-mining/mines-ministry-working-on-rolling-out-critical-mineral-mission-this-year-official/articleshow/112352112.cms,The Times of India,NewsAPI,2024-08-07T14:33:02Z
BlackLine (NASDAQ:BL) Price Target Lowered to $51.00 at Piper Sandler,https://www.etfdailynews.com/2024/08/07/blackline-nasdaqbl-price-target-lowered-to-51-00-at-piper-sandler/,ETF Daily News,NewsAPI,2024-08-07T14:32:54Z
Ethereum (ETH) Investors Purchase New ICO Currently At $0.00107,http://www.newsbtc.com/altcoin/ethereum-eth-investors-purchase-new-ico-currently-at-0-00107/,newsBTC,NewsAPI,2024-08-07T14:31:05Z
US and EU express concern about Move Forward demise,https://www.bangkokpost.com/thailand/politics/2843273/us-and-eu-express-concern-about-move-forward-demise,Bangkok Post,NewsAPI,2024-08-07T14:31:00Z
17 Thriving One-Person Business Ideas to Try,https://www.nichepursuits.com/one-person-business-ideas/,Nichepursuits.com,NewsAPI,2024-08-07T14:31:00Z
Super Micro Computer News: The Earnings Results That Have SMCI Stock Plunging Today,https://biztoc.com/x/fdd711d94779dd48,Biztoc.com,NewsAPI,2024-08-07T14:29:40Z
Bill Gates befriended Jeffrey Epstein for this favor from sex predator: report,https://www.foxnews.com/us/bill-gates-befriended-jeffrey-epstein-this-favor-from-sex-predator-report,Fox News,NewsAPI,2024-08-07T14:28:03Z
Dogecoin Struggles To Compete With New 1000x Rival,http://www.newsbtc.com/altcoin/dogecoin-struggles-to-compete-with-new-1000x-rival/,newsBTC,NewsAPI,2024-08-07T14:27:43Z
Personal finance links: a very simple philosophy,https://abnormalreturns.com/2024/08/07/personal-finance-links-a-very-simple-philosophy/,Abnormalreturns.com,NewsAPI,2024-08-07T14:25:09Z
"Flourish Ventures on repeat founders, emerging markets, and when not to hop on the AI bandwagon",https://techcrunch.com/podcast/flourish-ventures-on-repeat-founders-emerging-markets-and-when-not-to-hop-on-the-ai-bandwagon/,TechCrunch,NewsAPI,2024-08-07T14:24:42Z
"Sitharaman defends LTCG fresh amendments, says we have courage to change",https://www.business-standard.com/economy/news/sitharaman-defends-ltcg-fresh-amendments-says-we-have-courage-to-change-124080701570_1.html,Business Standard,NewsAPI,2024-08-07T14:23:57Z
Shiba Inu Whales Secure Their 1000x Profits From New ICO Rival,https://bitcoinist.com/shiba-inu-whales-secure-their-1000x-profits-from-new-ico-rival/,Bitcoinist,NewsAPI,2024-08-07T14:23:31Z
The best steam mops of 2024,https://www.nbcnews.com/select/shopping/best-steam-mops-rcna164836,NBC News,NewsAPI,2024-08-07T14:22:07Z
Finest No-deposit Bonuses 2024,https://www.bloguismo.com/finest-no-deposit-bonuses-2024-5/,Bloguismo.com,NewsAPI,2024-08-07T14:18:35Z
Chola MS General Insurance forges strategic partnership with Mahindra Finance,https://www.business-standard.com/markets/capital-market-news/chola-ms-general-insurance-forges-strategic-partnership-with-mahindra-finance-124080701595_1.html,Business Standard,NewsAPI,2024-08-07T14:18:00Z
CCT Demolition secures tailored invoice finance facility from Optimum Finance,https://www.leasinglife.com/news/cct-demolition-secures-tailored-invoice-finance-facility-from-optimum-finance/,Leasinglife.com,NewsAPI,2024-08-07T14:15:26Z
Yunus says ‘looking forward’ to helping Bangladesh ‘get out of trouble’,https://www.digitaljournal.com/world/yunus-says-looking-forward-to-helping-bangladesh-get-out-of-trouble/article,Digital Journal,NewsAPI,2024-08-07T14:14:58Z
Creative Edge Nutrition Inc (FITX) Stock Price & News - Google Finance,https://www.google.com/finance/quote/FITX:OTCMKTS,Google News,NewsAPI,2024-08-07T14:14:17Z
"Today’s Latest Business News, Finance and Share Market News at 10:00 am on 8 August 2024",https://indianexpress.com/audio/expresso-business-update/todays-latest-business-news-finance-and-share-market-news-at-1000-am-on-8-august-2024/9501771/,The Indian Express,GNews,2024-08-08T04:30:30Z
Mayor-President candidates kick earnings into high gear for second financial report,https://www.wbrz.com/news/mayor-president-candidates-kick-earnings-into-high-gear-for-second-financial-report,WBRZ,GNews,2024-08-08T04:00:00Z
"Loan write-offs fall 27% in 5 years, public sector banks outperform private peers in recoveries",https://theprint.in/economy/loan-write-offs-fall-27-in-5-years-public-sector-banks-outperform-private-peers-in-recoveries/2213079/,ThePrint,GNews,2024-08-08T02:00:49Z
Zelensky's Ukraine Hits Debt Peak As It Fails to Cover Expenses,https://sputnikglobe.com/20240807/zelenskys-ukraine-hits-debt-peak-as-it-fails-to-cover-expenses-1119667484.html,Sputnikglobe.com,NewsAPI,2024-08-07T15:30:06Z
Florida Buyers Told to 'Be Careful' in Housing Market by Real Estate Expert,https://www.newsweek.com/florida-buyers-told-careful-real-estate-housing-market-1935910,Newsweek,NewsAPI,2024-08-07T15:29:15Z
Kenyan protesters are demanding President Ruto be removed – what the law says about how that could happen,https://theconversation.com/kenyan-protesters-are-demanding-president-ruto-be-removed-what-the-law-says-about-how-that-could-happen-236329,The Conversation Africa,NewsAPI,2024-08-07T15:26:53Z
Lok Sabha Passes Bill To Amend Long Term Tax Provision On Properties,https://www.ndtv.com/india-news/lok-sabha-passes-bill-to-amend-long-term-tax-provision-on-properties-6286291,NDTV News,NewsAPI,2024-08-07T15:20:40Z
State refuses to back down as rise in road levy continues to hurt motorists,https://nation.africa/kenya/business/state-refuses-to-back-down-as-rise-in-road-levy-continues-to-hurt-motorists-4717624,Nation.africa,NewsAPI,2024-08-07T15:20:35Z
"Super Rare Games’ CEO reveals dream projects, Nintendo Switch 2 hopes",https://www.pockettactics.com/super-rare-games-interview,Pockettactics.com,NewsAPI,2024-08-07T15:18:46Z
"France, Germany slam Israel's Smotrich for comments on starving Gazans to death",https://www.haaretz.com/israel-news/2024-08-07/ty-article/.premium/france-germany-slam-israels-smotrich-for-comments-on-starving-gazans-to-death/00000191-2d2f-d4ad-a7ff-fd3fc82b0000,Haaretz,NewsAPI,2024-08-07T15:15:19Z
NASA delays next SpaceX crew launch due to ongoing Starliner problems - Engadget,https://slashdot.org/firehose.pl?op=view&amp;id=174692520,Slashdot.org,NewsAPI,2024-08-07T15:12:33Z
Do bulk deposits benefit banks?,https://www.thehindubusinessline.com/opinion/do-bulk-deposits-benefit-banks/article68497866.ece,BusinessLine,NewsAPI,2024-08-07T15:12:16Z
Money Experts Julien and Kiersten Saunders: 3 Ways To Raise a ‘Rich’ Kid,https://finance.yahoo.com/news/money-experts-julien-kiersten-saunders-151122289.html,Yahoo Entertainment,NewsAPI,2024-08-07T15:11:22Z
"Being fired decreases your salary by 26% over 11 years, Finance Ministry reveals",https://www.jpost.com/israel-news/article-813756,The Jerusalem Post,NewsAPI,2024-08-07T15:10:54Z
Softbank Group errs on the side of caution after Q1 profit,https://www.livemint.com/companies/company-results/softbank-group-ola-electric-swiggy-firstcry-ipo-flipkart-lenskart-ai-11723028369066.html,Livemint,NewsAPI,2024-08-07T15:10:01Z
A popular trading strategy just blew up in investors’ faces,https://www.cnn.com/2024/08/07/business/yen-carry-trade-stocks-nightcap?cid=external-feeds_iluminar_yahoo,CNN,NewsAPI,2024-08-07T15:09:47Z
Steps that can reduce IBC delays,https://www.thehindubusinessline.com/opinion/steps-that-can-reduce-ibc-delays/article68497845.ece,BusinessLine,NewsAPI,2024-08-07T15:09:40Z
VP asks KDEKS to boost Islamic finance innovation in Yogyakarta,https://en.antaranews.com/news/321595/vp-asks-kdeks-to-boost-islamic-finance-innovation-in-yogyakarta,Antaranews.com,NewsAPI,2024-08-07T15:08:21Z
Earnings call: BTB REIT reports mixed Q2 results amid market shifts,https://www.investing.com/news/stock-market-news/earnings-call-btb-reit-reports-mixed-q2-results-amid-market-shifts-93CH-3560044,Investing.com,NewsAPI,2024-08-07T15:07:21Z
ATM: Humans Are Not Built For Investing,https://ritholtz.com/2024/08/atm-humans-are-not-built-for-investing/,Ritholtz.com,NewsAPI,2024-08-07T15:00:21Z
Billionaire Sells His Home For A 65% Discount. Is The Ultra Luxury Real Estate Market In Trouble?,https://finance.yahoo.com/news/billionaire-sells-home-65-discount-150019293.html,Yahoo Entertainment,NewsAPI,2024-08-07T15:00:19Z
Measuring Tax Literacy In A Politically Charged Climate,https://taxprof.typepad.com/taxprof_blog/2024/08/measuring-tax-literacy-in-a-politically-charged-climate.html,Typepad.com,NewsAPI,2024-08-07T15:00:00Z
"PF rerouted to beverage corp, local body funds used to pay discom dues",https://theprint.in/politics/pf-rerouted-to-beverage-corp-local-body-funds-used-to-pay-discom-dues-jagan-govts-fiscal-fudge/2214015/,ThePrint,GNews,2024-08-08T15:02:04Z
Something's wrong with Andy Ogles' campaign finance reports,https://www.rawstory.com/somethings-wrong-with-andy-ogles-campaign-finance-report/,Raw Story,GNews,2024-08-08T14:04:43Z
Western allies condemn Israeli finance minister’s suggestion that starving Gaza might be justified,https://www.theglobeandmail.com/world/article-western-allies-condemn-israeli-finance-ministers-suggestion-that/,The Globe and Mail,GNews,2024-08-08T13:22:43Z
Money blog: Most expensive place to live in the world revealed - and it's not London or New York,https://news.sky.com/story/money-blog-most-expensive-place-to-live-in-the-world-revealed-and-its-not-london-or-new-york-13040934,Sky News,GNews,2024-08-08T12:13:00Z
Western allies condemn Israeli finance minister's suggestion that starving Gaza might be justified,https://www.thestar.com/news/world/middle-east/western-allies-condemn-israeli-finance-ministers-suggestion-that-starving-gaza-might-be-justified/article_cfa19d67-e512-58cb-a5d4-e3900e3d1fd8.html,Toronto Star,GNews,2024-08-08T11:09:00Z
Why Jay Powell refuses to be bullied by Wall Street,https://edition.cnn.com/2024/08/08/business/jerome-powell-wall-street-nightcap/index.html,Cable News Network,GNews,2024-08-08T10:00:02Z
31% annual jump in homeowner repossessions in second quarter of 2024,https://www.standard.co.uk/business/money/31-annual-jump-in-homeowner-repossessions-in-second-quarter-of-2024-b1175401.html,Evening Standard,GNews,2024-08-08T09:56:43Z
The Worst Man in Israel Makes a 'Moral' Argument for Genocide | Opinion,https://www.newsweek.com/worst-man-israel-makes-moral-argument-genocide-opinion-1936211,Newsweek,GNews,2024-08-08T09:27:02Z
Money blog: 'Doom spending' on the rise,https://news.sky.com/story/money-blog-doom-spending-on-the-rise-13040934,Sky News,GNews,2024-08-08T08:57:00Z
Money blog: The rise of 'doom spending' - what it is and how to stop,https://news.sky.com/story/money-news-consumer-mortgages-personal-finance-interest-rates-markets-sky-blog-latest-13040934,Sky News,GNews,2024-08-08T06:01:00Z
Procura por mestrados disparou mas propinas até 20 mil euros impedem alunos de prosseguir estudos,https://observador.pt/2024/08/11/procura-por-mestrados-disparou-mas-propinas-ate-20-mil-euros-impedem-alunos-de-prosseguir-estudos/,Observador.pt,NewsAPI,2024-08-11T11:28:10Z
Brasil tem 4ª maior nota em ranking do IIF sobre transparência de dívida em emergentes,https://www.mixvale.com.br/2024/07/18/brasil-tem-4a-maior-nota-em-ranking-do-iif-sobre-transparencia-de-divida-em-emergentes/,Portal Mix Vale,GNews,2024-07-18T15:58:00Z
"Sistema financeiro do futuro será mais ""humanizado""",https://epocanegocios.globo.com/colunas/cocriando-o-futuro/coluna/2024/07/sistema-financeiro-do-futuro-sera-mais-humanizado.ghtml,Época NEGÓCIOS,GNews,2024-07-18T09:00:54Z
Metade dos brasileiros desconhece o open finance,https://www.folhavitoria.com.br/economia/noticia/07/2024/metade-da-populacao-brasileira-desconhece-o-open-finance-mostra-pesquisa,Jornal Folha Vitória,GNews,2024-07-17T17:45:07Z
"Metade da população brasileira desconhece o Open Finance, mostra pesquisa",https://www.mixvale.com.br/2024/07/17/metade-da-populacao-brasileira-desconhece-o-open-finance-mostra-pesquisa/,Portal Mix Vale,GNews,2024-07-17T17:37:00Z
"Mask Bans Slowly Spread [cough, cough] in States and Localities",https://www.nakedcapitalism.com/2024/08/mask-bans-slowly-spread-cough-cough-in-states-and-localities.html,Nakedcapitalism.com,NewsAPI,2024-08-11T20:25:07Z
"Letters to the Editor, August 12, 2024: Best for the campaign",https://www.jpost.com/opinion/article-814285,The Jerusalem Post,NewsAPI,2024-08-11T20:20:52Z
Race at Colonial Downs becomes a qualifier for Kentucky Derby,https://richmond.com/news/state-regional/government-politics/virginia-derby-colonial-downs-horseracing-kentucky-derby-youngkin/article_ca6f1214-5815-11ef-9c0e-c3e68d825f73.html,Richmond.com,NewsAPI,2024-08-11T20:08:00Z
"Scheme that helps disabled drivers with car adaptation costs 'not fit-for-purpose', says Chambers",https://www.thejournal.ie/disabled-driver-adaptation-scheme-6456165-Aug2024/,TheJournal.ie,NewsAPI,2024-08-11T20:00:55Z
4 Times You Should Pick a Credit Union Over a Traditional Bank,https://finance.yahoo.com/news/4-times-pick-credit-union-200021144.html,Yahoo Entertainment,NewsAPI,2024-08-11T20:00:21Z
Alfonso Cuarón Remembers David Fincher Told Him to ‘Wait 6 Years’ to Make ‘Gravity’: ‘There’s No Tech’,https://www.indiewire.com/news/general-news/alfonso-cuaron-gravity-david-fincher-tech-1235035045/,IndieWire,NewsAPI,2024-08-11T20:00:00Z
Monday Morning Update 8/12/24,https://histalk2.com/2024/08/11/monday-morning-update-8-12-24/,Histalk2.com,NewsAPI,2024-08-11T19:35:46Z
Israel creates plan to bring in more foreign workers in place of Palestinians,https://www.jpost.com/business-and-innovation/all-news/article-814302,The Jerusalem Post,NewsAPI,2024-08-11T19:33:55Z
Suze Orman Says Ignoring This Will Ruin Your Investment Future – Here's What You Must Do Now To Secure Financial Success,https://finance.yahoo.com/news/suze-orman-says-ignoring-ruin-193014302.html,Yahoo Entertainment,NewsAPI,2024-08-11T19:30:14Z
The Irish Times view on tax and the budget: the scope for real relief is limited,https://www.irishtimes.com/opinion/editorials/2024/08/11/the-irish-times-view-on-tax-and-the-budget-the-scope-for-real-relief-is-limited/,The Irish Times,NewsAPI,2024-08-11T19:30:00Z
"From Citi to 3i to Hindenburg's crosshairs, the many lives of banker turned investor Anil Ahuja",https://economictimes.indiatimes.com/industry/banking/finance/banking/from-citi-to-3i-to-hindenburgs-crosshairs-the-many-lives-of-banker-turned-investor-anil-ahuja/articleshow/112449420.cms,The Times of India,NewsAPI,2024-08-11T19:25:36Z
From Citi to Hindenburg: Many lives of Anil Ahuja,https://economictimes.indiatimes.com/industry/banking/finance/banking/from-citi-to-3i-to-hindenburgs-crosshairs-the-many-lives-of-banker-turned-investor-anil-ahuja/articleshow/112453327.cms,The Times of India,NewsAPI,2024-08-11T19:25:36Z
3 ASX Stocks Estimated To Be 18.8% To 28.8% Below Intrinsic Value,https://finance.yahoo.com/news/3-asx-stocks-estimated-18-190502237.html,Yahoo Entertainment,NewsAPI,2024-08-11T19:05:02Z
Ripple Begins Beta Testing of Its New Stablecoin (RLUSD) on XRPL and Ethereum,https://www.cryptoglobe.com/latest/2024/08/ripple-begins-beta-testing-of-its-new-stablecoin-rlusd-on-xrpl-and-ethereum/,CryptoGlobe,NewsAPI,2024-08-11T19:04:52Z
NOW he wants peace: Oct. 7 mastermind and new Hamas chief Yahya Sinwar pushing cease-fire,https://nypost.com/2024/08/11/world-news/new-hamas-chief-yahya-sinwar-now-pushing-for-cease-fire-deal-in-gaza/,New York Post,NewsAPI,2024-08-11T18:55:28Z
Historic shift: Attorney-General uses significant economic pressure to enforce haredi draft,https://www.jpost.com/israel-news/article-814298,The Jerusalem Post,NewsAPI,2024-08-11T18:49:09Z
"Inflation data, retail sales, Walmart earnings await a jumpy stock market: What to know this week - Yahoo Finance",https://slashdot.org/firehose.pl?op=view&amp;id=174724540,Slashdot.org,NewsAPI,2024-08-11T18:34:06Z
"To the top, by dint of merit: Meet Somanathan, newly appointed Cabinet secy",https://www.business-standard.com/india-news/to-the-top-by-dint-of-merit-meet-somanathan-newly-appointed-cabinet-secy-124081200001_1.html,Business Standard,NewsAPI,2024-08-11T18:33:48Z
Jeffrey Epstein’s Infamous ‘Little Black Book’ Hits Auction Block: ‘Criminal Relic’ Holds Entries for 386 Power Players — Including Personal Numbers for Donald Trump and Robert F Kennedy Jr!,https://radaronline.com/p/jeffrey-epsteins-black-book-auction-donald-trump-robert-f-kennedy-jr/,Radaronline.com,NewsAPI,2024-08-11T18:30:00Z
Hindenburg row: Left parties demand JPC probe,https://thehillstimes.in/national/hindenburg-row-left-parties-demand-jpc-probe,Thehillstimes.in,NewsAPI,2024-08-11T18:30:00Z
"Delhi HC seeks govt, L-G response to BJP MLA’s plea for implementation of 6th Finance Commission",https://indianexpress.com/article/cities/delhi/delhi-hc-seeks-govt-l-g-response-to-bjp-mlas-plea-for-implementation-of-6th-finance-commission-9510187/,The Indian Express,GNews,2024-08-12T15:57:33Z
"BJP frames Hindenburg report as ‘part of attack on Indian institutions’, likely to stay silent on SEBI chief",https://indianexpress.com/article/political-pulse/bjp-hindenburg-report-indian-institutions-attack-sebi-chief-9510106/,The Indian Express,GNews,2024-08-12T14:38:09Z
Money blog: Blue Light discount anger as teachers added; pound falls for four straight weeks,https://news.sky.com/story/money-blog-blue-light-discount-anger-as-teachers-added-pound-falls-for-four-straight-weeks-13040934,Sky News,GNews,2024-08-12T14:02:00Z
Legacy of Antonio Delfim Netto: Architect of Brazil’s Economic Miracle,https://www.devdiscourse.com/article/politics/3049825-legacy-of-antonio-delfim-netto-architect-of-brazils-economic-miracle,Devdiscourse,GNews,2024-08-12T13:44:41Z
"Council writes off millions in unpaid debt, finance report reveals",https://www.birminghammail.co.uk/black-country/council-writes-millions-unpaid-debt-29724242,Birmingham Live,GNews,2024-08-12T13:13:50Z
Bajaj Finance Receives Show Cause Notice for Rs 342 Crore GST Demand,https://www.news18.com/business/tax/bajaj-finance-receives-show-cause-notice-for-rs-342-crore-gst-demand-9013366.html,News18,GNews,2024-08-12T12:39:18Z
Money blog: Blue Light discount anger as teachers added - but poll suggests public support move,https://news.sky.com/story/money-blog-blue-light-discount-anger-as-teachers-added-but-poll-suggests-public-support-move-13040934,Sky News,GNews,2024-08-12T12:37:00Z
"Today’s Latest Business News, Finance and Share Market News at 5:30 pm on 12 August 2024",https://indianexpress.com/audio/expresso-business-update/todays-latest-business-news-finance-and-share-market-news-at-530-pm-on-12-august-2024/9508789/,The Indian Express,GNews,2024-08-12T12:00:46Z
Money blog: Blue Light discount for teachers prompts backlash - but poll suggests public support move,https://news.sky.com/story/money-blog-blue-light-discount-for-teachers-prompts-backlash-but-poll-suggests-public-support-move-13040934,Sky News,GNews,2024-08-12T11:16:00Z
Is The Thrill Of Victory Worth The Agony Of Defeat? (Avoid These 2 Sucker Yields),https://seekingalpha.com/article/4713615-thrill-of-victory-worth-agony-defeat-avoid-2-sucker-yields,Seeking Alpha,GNews,2024-08-12T11:00:00Z
Gustavo Franco: Brasil é exemplo mundial em dinheiro digital,https://dinheirama.com/gustavo-franco-brasil-e-exemplo-mundial-em-dinheiro-digital/,Dinheirama.com,NewsAPI,2024-08-13T02:23:13Z
Dave Ramsey has blunt words on a major money struggle you can fix,https://biztoc.com/x/1c3331856d4a7ed6,Biztoc.com,NewsAPI,2024-08-13T22:26:00Z
"E-Commerce Growth Lifted This Tech Giant's Earnings, and Its Stock Jumped 12%",https://www.investopedia.com/sea-limited-stock-price-jumps-ecommerce-growth-online-shopping-site-shopee-8694618,Investopedia,NewsAPI,2024-08-13T22:24:19Z
DLT to investigate Chinese transport sector 'dominance',https://www.bangkokpost.com/thailand/general/2846492/dlt-to-investigate-chinese-transport-sector-dominance,Bangkok Post,NewsAPI,2024-08-13T22:21:00Z
Superior Announces Second Quarter Results and Maintains Overall 2024 Adjusted EBITDA Growth Expectations,https://financialpost.com/pmn/business-wire-news-releases-pmn/superior-announces-second-quarter-results-and-maintains-overall-2024-adjusted-ebitda-growth-expectations,Financial Post,NewsAPI,2024-08-13T22:20:44Z
Streamly Fintech Insights: From the Future of Finance to Innovations in Cybersecurity,https://finovate.com/streamly-fintech-insights-from-the-future-of-finance-to-innovations-in-cybersecurity/,Finovate.com,NewsAPI,2024-08-13T22:16:37Z
From Bitcoin to Solana: Canadian Crypto Investment Firm Cypherpunk’s New Direction Explained by CEO Leah Wald,https://www.cryptoglobe.com/latest/2024/08/from-bitcoin-to-solana-canadian-crypto-investment-firm-cypherpunks-new-direction-explained-by-ceo-leah-wald/,CryptoGlobe,NewsAPI,2024-08-13T22:15:20Z
KWESST Micro Systems Inc. Announces Closing of Registered Direct Offering,https://www.investing.com/news/press-releases/kwesst-micro-systems-inc-announces-closing-of-registered-direct-offering-93CH-3570250,Investing.com,NewsAPI,2024-08-13T22:12:04Z
"NextGen Food Robotics Corp. Announces Delay in Filing Audited Annual Financial Statements, Management's Discussion and Analysis and Annual Information Form",https://www.investing.com/news/press-releases/nextgen-food-robotics-corp-announces-delay-in-filing-audited-annual-financial-statements-managements-discussion-and-analysis-and-annual-information-form-93CH-3570249,Investing.com,NewsAPI,2024-08-13T22:12:03Z
CBA shares on watch after FY24 earnings and dividends beat expectations,https://www.fool.com.au/2024/08/14/cba-shares-on-watch-after-fy24-earnings-and-dividends-beat-expectations/,Motley Fool Australia,NewsAPI,2024-08-13T22:07:12Z
"NextGen Food Robotics Corp. Announces Delay in Filing Audited Annual Financial Statements, Management’s Discussion and Analysis and Annual Information Form",https://financialpost.com/globe-newswire/nextgen-food-robotics-corp-announces-delay-in-filing-audited-annual-financial-statements-managements-discussion-and-analysis-and-annual-information-form,Financial Post,NewsAPI,2024-08-13T22:05:42Z
Al Gore's Strategic Moves in Q2 2024: A Closer Look at Applied Materials Inc,https://finance.yahoo.com/news/al-gores-strategic-moves-q2-220125621.html,Yahoo Entertainment,NewsAPI,2024-08-13T22:01:25Z
David Rolfe's Strategic Moves in Edwards Lifesciences Corp Highlight Q2 2024 Investments,https://finance.yahoo.com/news/david-rolfes-strategic-moves-edwards-220115921.html,Yahoo Entertainment,NewsAPI,2024-08-13T22:01:15Z
"NextGen Food Robotics Corp. Announces Delay in Filing Audited Annual Financial Statements, Management’s Discussion and Analysis and Annual Information Form",https://www.globenewswire.com/news-release/2024/08/13/2929718/0/en/NextGen-Food-Robotics-Corp-Announces-Delay-in-Filing-Audited-Annual-Financial-Statements-Management-s-Discussion-and-Analysis-and-Annual-Information-Form.html,GlobeNewswire,NewsAPI,2024-08-13T22:01:00Z
Gritstone bio Reports Second Quarter 2024 Financial Results and Provides Corporate Updates,https://www.investing.com/news/press-releases/gritstone-bio-reports-second-quarter-2024-financial-results-and-provides-corporate-updates-93CH-3570216,Investing.com,NewsAPI,2024-08-13T22:00:09Z
